[
  {
    "id": "CIE-001",
    "metadata": {
      "id": "CIE-001",
      "source": {
        "type": "competition",
        "name": "《一饭封神2》创新豆腐花/菊花豆腐",
        "url": "https://v.qq.com/x/cover/mzc00200lk7yd24/u4102e6bi22.html",
        "date": "2026-07-29（节目上线；检索于2026-08-25）"
      },
      "creator": {
        "chef": "客家冲击波（节目昵称；真实姓名在本数据源中未可靠确认）",
        "restaurant": "未可靠确认"
      },
      "data_split": "competition_set"
    },
    "culinary_context": {
      "traditional_reference": [
        {
          "name": "客家甜豆腐花",
          "core_principle": "以豆香、凝胶嫩度与糖水形成清爽甜品体验"
        },
        {
          "name": "菊花豆腐",
          "core_principle": "以极细刀工把豆腐展开成花形，技术价值主要来自切割完整度与汤中呈形"
        }
      ],
      "innovation_space": [
        "texture transformation",
        "cooking technique",
        "presentation",
        "ingredient transformation"
      ]
    },
    "dish_information": {
      "name": "创新客家豆腐花（菊花豆腐、浓缩豆浆与液氮‘化石’）",
      "description": "参赛者把客家甜豆腐花设为母题：以精细刀工把豆腐切成菊花形；用离心设备澄清并浓缩豆浆；再以液氮制造低温凝固定型的视觉层。公开节目切片与报道能够支持这些核心步骤，但没有公开标准配方，因此本条只记录可复核的结构，不虚构克数、温度或时间。[CIE001-S1][CIE001-S2][CIE001-S3]",
      "ingredients": [
        {
          "name": "豆腐",
          "culinary_role": "可食主体与刀工载体",
          "physical_property": "高含水、脆弱凝胶网络，细切后极易断裂"
        },
        {
          "name": "豆浆",
          "culinary_role": "基础风味与浓缩层",
          "physical_property": "蛋白质分散体系；浓缩会同步放大豆香与涩/生味"
        },
        {
          "name": "糖水",
          "culinary_role": "甜味背景与水相介质",
          "physical_property": "降低豆腥感知但也可能掩盖层次"
        },
        {
          "name": "液氮",
          "culinary_role": "过程介质而非风味食材",
          "physical_property": "极低温、快速汽化，可造成快速冻结与脆化"
        }
      ],
      "techniques": [
        {
          "name": "菊花刀工",
          "purpose": "把普通豆腐转化为视觉中心",
          "expected_effect": "形成细丝花瓣并增加入口表面积"
        },
        {
          "name": "离心澄清/浓缩",
          "purpose": "分离颗粒并集中豆浆风味",
          "expected_effect": "得到更清澈或更高固形物的豆浆相"
        },
        {
          "name": "液氮速冻",
          "purpose": "快速定型并制造温度/形态反差",
          "expected_effect": "形成冻结层；回温后稳定性取决于体系"
        }
      ]
    },
    "innovation_trace": {
      "existing_culinary_context": {
        "precedents": [
          "客家甜豆腐花",
          "传统菊花豆腐",
          "现代料理中的离心澄清",
          "液氮冻结甜品"
        ],
        "relationship": "它不是从无到有地发明豆腐甜品，而是把两条既有路径叠合：传统刀工负责形象，现代设备负责澄清、浓缩与瞬时冻结。创新判断的关键不是设备数量，而是这些操作是否改变了味觉组织和食用体验。"
      },
      "ingredient_and_technique_knowledge": {
        "ingredient_knowledge": [
          {
            "ingredient": "豆腐/豆浆",
            "property": "豆蛋白凝胶柔嫩而承味；浓缩能提高豆香强度，也会放大不理想的豆腥、涩感"
          },
          {
            "ingredient": "糖",
            "property": "甜味能圆润豆类气味，但过量会把菜压回单一糖水豆花"
          }
        ],
        "technique_knowledge": [
          {
            "technique": "离心",
            "principle": "按密度差分离悬浮物；它能改变清澈度和浓度，却不会自动产生新的风味关系"
          },
          {
            "technique": "液氮速冻",
            "principle": "高降温速率可形成较小冰晶，但成品回温、含水和服务节奏决定最终口感"
          },
          {
            "technique": "极细刀工",
            "principle": "增加表面积和视觉脆弱感，成功依赖切割一致性与转移完整度"
          }
        ]
      },
      "innovation_delta": {
        "before": "传统甜豆腐花以凝固豆浆、糖水和柔嫩口感为主；菊花豆腐通常属于刀工展示，常置于清汤中。",
        "after": "同一盘中加入菊花造型、离心浓缩豆浆和液氮冻结层，形成多技术的仪式化甜豆腐花。",
        "change_type": [
          "technique transfer",
          "texture transformation",
          "presentation"
        ],
        "magnitude": 3
      },
      "mechanistic_justification": {
        "flavor_mechanism": "浓缩豆浆理论上可增强豆香，糖水提供熟悉锚点；但刀工和液氮本身不贡献新风味，若浓缩没有建立甜、豆香与温度的层次，味觉仍与普通豆花近似。",
        "texture_mechanism": "细切豆腐提供极轻嫩、易散的触感，冻结层提供脆/冷反差；两者能否在同一口中协调，取决于回温速度和含水迁移。",
        "chemical_or_culinary_basis": "机制部分成立，但‘技术复杂度→创新价值’的推论不成立。公开报道转述评审认为基础吃味仍接近街边豆花，说明新增过程没有按比例转化为可感知收益。[CIE001-S3]",
        "strength": "medium"
      },
      "creative_hypothesis": "把客家豆腐花从日常糖水重新编码为兼具国宴刀工、澄清浓缩与冻结形态的精致甜品，同时保留可识别的豆香记忆。",
      "risk_and_constraint": {
        "risk": "技术叙事压过味觉；浓缩放大豆腥；低温压低香气释放；菊花细丝在转移与食用时破损。",
        "tradeoff": "视觉与工艺复杂度上升，但服务稳定性、温度控制和风味可读性下降。",
        "failure_condition": "盲尝时新增层次不能被识别，或食客只感到‘更复杂地做了一碗普通豆花’。"
      }
    },
    "human_evaluation_signal": {
      "evaluation_type": "judge_score",
      "positive_signal": "刀工完整、仪式感强，能让传统豆花获得鲜明视觉身份。[CIE001-S1][CIE001-S2]",
      "negative_signal": "公开报道的证据性转述指出：技术投入没有显著超越普通豆花的基础吃味，且低温/结构带来口感局限。[CIE001-S3]",
      "judge_comment": "证据性转述（非逐字引语）：评审认可刀工与呈现，但认为核心味觉没有随离心、液氮等技术同步升级。",
      "final_result": "eliminated"
    },
    "cie_annotation": {
      "innovation_category": "Surface Innovation",
      "failure_mode": [
        "Technique Inflation",
        "Novelty Bias"
      ],
      "scores": {
        "culinary_knowledge_grounding": 4,
        "existing_culinary_precedent_analysis": 4,
        "innovation_delta_quality": 2,
        "mechanistic_plausibility": 3,
        "innovation_value": 2,
        "realization_quality": 2
      },
      "gold_reasoning": "该案有真实传统锚点，机制也不是完全无效，因此不能标成随机噱头；但主要增量集中在设备、形态和服务仪式，而不是新的风味架构。菊花刀工改变外观与表面积，离心和冻结改变物理状态，却没有证据表明它们建立了必要的新味觉关系。人类反馈又指向‘基础吃味近似普通豆花’，故创新价值与实现质量应低于技术展示分。最典型的错误是看到离心机、液氮与国宴刀工就自动给高创新分；CIE要求追问：去掉这些技术后，核心体验是否显著损失？若答案主要是‘少了戏剧性’，则属于 Surface Innovation。"
    },
    "benchmark_tags": [
      "negative_example",
      "surface_innovation",
      "technique_inflation",
      "competition",
      "human_judgement",
      "evidence_mixed"
    ]
  },
  {
    "id": "CIE-002",
    "metadata": {
      "id": "CIE-002",
      "source": {
        "type": "competition",
        "name": "《一饭封神2》五种海蟹炒米粉（蟹蟹你的爱）",
        "url": "https://view.inews.qq.com/a/20260803V04PV400",
        "date": "2026-07-30至2026-08-03（检索于2026-08-25）"
      },
      "creator": {
        "chef": "梁经伦 / Chef Will Leung（公开账号与节目材料）",
        "restaurant": "未在本样本中作为评价依据"
      },
      "data_split": "competition_set"
    },
    "culinary_context": {
      "traditional_reference": [
        {
          "name": "闽南/潮汕海鲜炒米粉",
          "core_principle": "以海鲜高汤润粉、猛火收汁并追求镬气"
        },
        {
          "name": "蟹粉/蟹膏拌面饭",
          "core_principle": "把甲壳类鲜味和脂香集中到主食载体"
        }
      ],
      "innovation_space": [
        "ingredient stacking",
        "flavor architecture",
        "cooking technique"
      ]
    },
    "dish_information": {
      "name": "五种海蟹炒米粉（蟹蟹你的爱）",
      "description": "以多种海蟹拆肉、熬汤并与米粉合炒，目标是让米粉吸收蟹汤、蟹膏与炒制香气。创作者公开材料称其招牌为‘五种海蟹炒米粉’，节目切片强调蟹肉与镬气；具体五种蟹的品种未在可访问文字资料中完整列明，因此本数据不补造品种。[CIE002-S1][CIE002-S2]",
      "ingredients": [
        {
          "name": "多种海蟹",
          "culinary_role": "鲜味来源与卖点",
          "physical_property": "蟹肉细嫩、易失水；蟹膏富脂，风味浓但易腥"
        },
        {
          "name": "米粉",
          "culinary_role": "吸汁与承味主体",
          "physical_property": "多孔淀粉网络，回软后易吸汤，也易断、黏或糊"
        },
        {
          "name": "蟹汤",
          "culinary_role": "连接蟹与米粉的风味介质",
          "physical_property": "含可溶性鲜味物质与胶质，浓缩后咸鲜显著"
        },
        {
          "name": "香辛料/葱蒜",
          "culinary_role": "去腥与炒香背景",
          "physical_property": "挥发性强，高温能建立顶香但过量会遮蔽蟹味"
        }
      ],
      "techniques": [
        {
          "name": "拆蟹取肉",
          "purpose": "剔除硬壳并保护纤维",
          "expected_effect": "提高可食性，减少壳渣"
        },
        {
          "name": "蟹壳熬汤",
          "purpose": "回收壳与组织中的风味",
          "expected_effect": "建立浓缩海鲜底味"
        },
        {
          "name": "猛火合炒与收汁",
          "purpose": "让米粉吸收汤汁并产生炒香",
          "expected_effect": "粉体干爽而着味，形成镬气"
        }
      ]
    },
    "innovation_trace": {
      "existing_culinary_context": {
        "precedents": [
          "海鲜炒米粉",
          "蟹粉拌面",
          "甲壳熬汤后回灌主食"
        ],
        "relationship": "结构本身成熟：海鲜提供鲜味，汤汁把风味迁移到淀粉，猛火收汁控制干湿。所谓创新主要来自把多个蟹种并列，而不是创建新角色或新技术。"
      },
      "ingredient_and_technique_knowledge": {
        "ingredient_knowledge": [
          {
            "ingredient": "蟹肉与蟹膏",
            "property": "呈味核苷酸、氨基酸与脂溶性香气共同形成甜鲜和膏香；不同蟹的差异必须可感知才有叠加价值"
          },
          {
            "ingredient": "米粉",
            "property": "吸液能力使其适合承接浓汤，但过度翻炒或水量过大会断裂、发黏"
          }
        ],
        "technique_knowledge": [
          {
            "technique": "壳熬汤",
            "principle": "通过热水萃取和浓缩回收鲜味；烘烤/炒香壳可增加焦香，但也可能引入苦腥"
          },
          {
            "technique": "镬炒收汁",
            "principle": "高热与快速翻动兼顾蒸发和表面香气，窗口很窄"
          }
        ]
      },
      "innovation_delta": {
        "before": "传统海蟹炒米粉通常使用一种主蟹或一组海鲜，以蟹汤和镬气完成风味。",
        "after": "同时使用五种海蟹，并把‘品种数量’作为主体叙事与高级感来源。",
        "change_type": [
          "ingredient stacking"
        ],
        "magnitude": 2
      },
      "mechanistic_justification": {
        "flavor_mechanism": "蟹汤与蟹膏对米粉有明确增鲜机制；但若五种蟹的风味在熬汤和合炒后趋同，增加品种只提高成本和叙事复杂度，不提高可辨识层次。",
        "texture_mechanism": "拆出的蟹肉提供纤维感，米粉应保持分离和弹性；汤量、油量与火力失衡会导致粉黏、蟹肉柴。",
        "chemical_or_culinary_basis": "‘蟹+汤+米粉’机制强，‘五种比一种更创新’机制弱。评价应把菜好吃与创新增量分开。",
        "strength": "medium"
      },
      "creative_hypothesis": "通过多蟹种的甜鲜、膏香和纤维差异，构建比单一海蟹更宽的海味谱系，并由米粉统一承载。",
      "risk_and_constraint": {
        "risk": "多蟹风味互相平均化；蟹膏过重产生腥腻；品种数量成为不可盲辨的奢华堆叠。",
        "tradeoff": "理论风味宽度增加，同时原料成本、拆解劳动与批次稳定性显著上升。",
        "failure_condition": "盲尝无法区分多蟹与单蟹高汤版本，或增加蟹种后只有鲜度更重而无清晰层次。"
      }
    },
    "human_evaluation_signal": {
      "evaluation_type": "judge_score",
      "positive_signal": "节目切片突出蟹肉爆香、米粉吸汁和镬气，说明传统执行逻辑具有完成度。[CIE002-S1]",
      "negative_signal": "未找到可独立核验的逐字评委负评；CIE负面信号是分析性判断：多蟹数量不等同于风味架构创新。",
      "judge_comment": "分析者综合评价（非评委原话）：若多蟹差异未被保留，菜品应被视为高规格海蟹炒米粉，而非结构性创新。",
      "final_result": "praised"
    },
    "cie_annotation": {
      "innovation_category": "Surface Innovation",
      "failure_mode": [
        "Ingredient Stacking",
        "Novelty Bias"
      ],
      "scores": {
        "culinary_knowledge_grounding": 4,
        "existing_culinary_precedent_analysis": 4,
        "innovation_delta_quality": 2,
        "mechanistic_plausibility": 4,
        "innovation_value": 2,
        "realization_quality": 4
      },